{
  "id": "00000000-0000-4000-8000-000000000013",
  "type": "invoice",
  "title": "Invoice INV-2026-031",
  "created_at": "2026-09-20T09:00:00Z",
  "project_id": "llanos-screen",
  "client_id": "frontera",
  "legal_tag": "lt-frontera-nda-2026",
  "origin": {
    "source": "zoho-books",
    "external_id": "inv-031"
  },
  "content_hash": "sha256:aaaaaaaaaaaaaaaaaaaaaaaaaaaaaaaaaaaaaaaaaaaaaaaaaaaaaaaaaaaaaaaa",
  "version": 1,
  "extracted": {
    "number": "INV-2026-031",
    "amount": 18500,
    "currency": "USD",
    "due": "2026-10-15",
    "paid": false
  }
}
