{
  "id": "00000000-0000-4000-8000-000000000011",
  "type": "letter",
  "title": "Letter ATC-2026-0142 to Ecopetrol",
  "created_at": "2026-09-20T09:00:00Z",
  "project_id": "llanos-screen",
  "client_id": "frontera",
  "legal_tag": "lt-frontera-nda-2026",
  "origin": {
    "source": "upload"
  },
  "content_hash": "sha256:aaaaaaaaaaaaaaaaaaaaaaaaaaaaaaaaaaaaaaaaaaaaaaaaaaaaaaaaaaaaaaaa",
  "version": 1,
  "authored_at": "2026-09-18T00:00:00Z",
  "authors": [
    "chris"
  ],
  "organisation_ids": [
    "ecopetrol"
  ],
  "reference_no": "ATC-2026-0142",
  "cites": [
    "run:00000000-0000-4000-8000-000000000002"
  ]
}
