{
  "id": "00000000-0000-4000-8000-000000000012",
  "type": "email",
  "title": "RE: Cubiro data room access",
  "created_at": "2026-09-20T09:00:00Z",
  "project_id": "llanos-screen",
  "client_id": "frontera",
  "legal_tag": "lt-frontera-nda-2026",
  "origin": {
    "source": "zoho-mail",
    "external_id": "<abc@frontera.com>"
  },
  "content_hash": "sha256:aaaaaaaaaaaaaaaaaaaaaaaaaaaaaaaaaaaaaaaaaaaaaaaaaaaaaaaaaaaaaaaa",
  "version": 1,
  "filing": {
    "method": "classifier",
    "confidence": 0.92
  },
  "extracted": {
    "contacts": [
      "maria@frontera.com"
    ]
  }
}
